{
  "schemaVersion": "0.1.0",
  "engineVersion": "0.1.0",
  "rigFamily": "starter-humanoid@1",
  "equipped": [
    {
      "assetId": "starter.accessory.brim-hat",
      "version": "1.0.0"
    },
    {
      "assetId": "starter.accessory.wings",
      "version": "1.0.0"
    },
    {
      "assetId": "starter.base.broad",
      "version": "1.0.0"
    },
    {
      "assetId": "starter.bottom.wide-trousers",
      "version": "1.0.0"
    },
    {
      "assetId": "starter.brows.bold",
      "version": "1.0.0"
    },
    {
      "assetId": "starter.ears.fae",
      "version": "1.0.0"
    },
    {
      "assetId": "starter.eyes.deep",
      "version": "1.0.0"
    },
    {
      "assetId": "starter.hair.coiled",
      "version": "1.0.0"
    },
    {
      "assetId": "starter.head.round",
      "version": "1.0.0"
    },
    {
      "assetId": "starter.mouth.smile",
      "version": "1.0.0"
    },
    {
      "assetId": "starter.nose.button",
      "version": "1.0.0"
    },
    {
      "assetId": "starter.outerwear.long-coat",
      "version": "1.0.0"
    },
    {
      "assetId": "starter.shoes.low",
      "version": "1.0.0"
    },
    {
      "assetId": "starter.top.sweater",
      "version": "1.0.0"
    }
  ],
  "palette": {
    "accessory.back": "#9E8458",
    "accessory.hat": "#54314D",
    "body.arm.left": "#714330",
    "body.arm.right": "#714330",
    "garment.bottom": "#352F35",
    "garment.outerwear": "#244B3C",
    "garment.shoes": "#513D39",
    "garment.top": "#D4A73A",
    "hair.base": "#8A4A2C",
    "skin.base": "#714330"
  },
  "parameters": {
    "expression": "neutral"
  },
  "seed": 3003,
  "metadata": {
    "name": "Occlusion Stress"
  }
}
